{
  "schema_version": "1.0",
  "project": {
    "deck_id": "tastecraft-demo",
    "name": "TasteCraft Demo Deck",
    "locale": "zh-CN",
    "created_at": "2026-06-06T00:00:00.000+08:00",
    "updated_at": "2026-06-06T00:00:00.000+08:00"
  },
  "brief": {
    "topic": "AI-assisted presentation craft",
    "audience": "Strategy and design leads",
    "scenario": "internal-report",
    "goal": "Align the team on a repeatable deck design workflow.",
    "tone": "Precise, premium, editorial",
    "constraints": [
      "No external dependencies",
      "Static local export only"
    ]
  },
  "output": {
    "target_format": "auto",
    "aspect_ratio": "16:9",
    "slide_count": 7,
    "mode": "batch_with_single_page_experiments",
    "model_capabilities": {
      "image_generation": true,
      "pptx_export": true,
      "browser_preview": true
    }
  },
  "theme": {
    "palette": {
      "preset_id": "market-slate",
      "custom": false,
      "colors": {
        "background": "#F7F8FA",
        "surface": "#FFFFFF",
        "text": "#18202A",
        "muted_text": "#5D6B7A",
        "primary": "#205B73",
        "secondary": "#2F855A",
        "accent": "#E76F51"
      }
    },
    "typography": {
      "heading_style": "Editorial grotesk, high contrast scale",
      "body_style": "Readable sans, compact evidence blocks",
      "density": "balanced"
    },
    "logo": {
      "enabled": true,
      "source": "Local brand mark",
      "placement": "cover-and-closing",
      "reverse_version_allowed": true,
      "brand_mode": "light-brand"
    },
    "imagery": {
      "ai_image_enabled": true,
      "style_direction": "Documentary product stills with clean workspace context",
      "forbidden_elements": [
        "generic 3D blobs",
        "fake dashboard numbers",
        "watermarks"
      ]
    }
  },
  "pages": [
    {
      "page_id": "page-01-cover",
      "index": 1,
      "type": "cover",
      "title": "AI-assisted presentation craft",
      "objective": "Set the narrative frame and design expectation.",
      "density": "balanced",
      "content_inputs": {
        "notes": "Sample cover page generated by the console."
      },
      "layout_variant": "full-bleed-title",
      "visual_role": "hero image",
      "logo_policy": "cover mark",
      "image_prompt_refs": [
        "prompt-page-01-cover"
      ],
      "overrides": {},
      "status": "needs_prompt"
    },
    {
      "page_id": "page-02-agenda",
      "index": 2,
      "type": "agenda",
      "title": "Path of the Conversation",
      "objective": "Show the session sequence and decision flow.",
      "density": "balanced",
      "content_inputs": {
        "notes": "Sample agenda page generated by the console."
      },
      "layout_variant": "numbered-agenda",
      "visual_role": "structured list",
      "logo_policy": "subtle footer",
      "image_prompt_refs": [
        "prompt-page-02-agenda"
      ],
      "overrides": {},
      "status": "needs_prompt"
    },
    {
      "page_id": "page-03-chapter",
      "index": 3,
      "type": "chapter",
      "title": "Chapter Break",
      "objective": "Create a clean transition into the core argument.",
      "density": "balanced",
      "content_inputs": {
        "notes": "Sample chapter page generated by the console."
      },
      "layout_variant": "section-divider",
      "visual_role": "typographic emphasis",
      "logo_policy": "section mark",
      "image_prompt_refs": [
        "prompt-page-03-chapter"
      ],
      "overrides": {},
      "status": "needs_prompt"
    },
    {
      "page_id": "page-04-content",
      "index": 4,
      "type": "content",
      "title": "Core Operating Model",
      "objective": "Explain the main idea with concise supporting detail.",
      "density": "balanced",
      "content_inputs": {
        "notes": "Sample content page generated by the console."
      },
      "layout_variant": "two-column-evidence",
      "visual_role": "diagram support",
      "logo_policy": "subtle footer",
      "image_prompt_refs": [
        "prompt-page-04-content"
      ],
      "overrides": {},
      "status": "needs_prompt"
    },
    {
      "page_id": "page-05-data",
      "index": 5,
      "type": "data",
      "title": "Performance Snapshot",
      "objective": "Present the evidence pattern without visual clutter.",
      "density": "balanced",
      "content_inputs": {
        "notes": "Sample data page generated by the console."
      },
      "layout_variant": "metric-strip-plus-chart",
      "visual_role": "chart emphasis",
      "logo_policy": "subtle footer",
      "image_prompt_refs": [
        "prompt-page-05-data"
      ],
      "overrides": {},
      "status": "needs_prompt"
    },
    {
      "page_id": "page-06-visual",
      "index": 6,
      "type": "visual",
      "title": "Experience Reference",
      "objective": "Show the desired look, scene, or product state.",
      "density": "balanced",
      "content_inputs": {
        "notes": "Sample visual page generated by the console."
      },
      "layout_variant": "image-led-comparison",
      "visual_role": "large visual",
      "logo_policy": "none",
      "image_prompt_refs": [
        "prompt-page-06-visual"
      ],
      "overrides": {},
      "status": "needs_prompt"
    },
    {
      "page_id": "page-07-closing",
      "index": 7,
      "type": "closing",
      "title": "Decision and Next Step",
      "objective": "Land the recommendation and ownership path.",
      "density": "balanced",
      "content_inputs": {
        "notes": "Sample closing page generated by the console."
      },
      "layout_variant": "closing-commitments",
      "visual_role": "summary signal",
      "logo_policy": "closing mark",
      "image_prompt_refs": [
        "prompt-page-07-closing"
      ],
      "overrides": {},
      "status": "needs_prompt"
    }
  ],
  "experiments": [],
  "qa": {
    "required_fields_complete": true,
    "all_required_prompts_confirmed": false,
    "contrast_warnings": [],
    "export_ready": false
  }
}
